{
  "id": "prototype-tr",
  "version": "1.0.0",
  "startSceneId": "apartment_01",
  "scenes": [
    {
      "id": "apartment_01",
      "chapterId": "chapter_01",
      "city": "İstanbul",
      "location": "Esenler - Terk Edilmiş Apartman",
      "day": 1,
      "time": "22:45",
      "isNight": true,
      "title": "Merdivendeki Ses",
      "sceneImage": "images/scenes/istanbul/staircase_sound.webp",
      "backgroundSceneImage": "images/scenes/city_night.webp",
      "oneShotSounds": ["audio/sfx/metal_scrape.wav"],
      "noiseIntensity": 0.035,
      "topMessages": [
        {"speaker":"Büşra","text":"Burada kalırsak sabaha çıkamayız.","tone":"Uyarı"},
        {"speaker":"Yesking","text":"Servis kapısının kilidi elektrikli olabilir.","tone":"Bilgi"},
        {"speaker":"Bedo","text":"Merdivende bir şey hareket etti.","tone":"Tehlike"}
      ],
      "content": [
        {"type":"narration","text":"Koridorun sonundan metalik bir sürtünme sesi geliyor. Nefesini tutuyorsun. Arkanda bekleyen ekip, karar vermen için sana bakıyor."},
        {"type":"dialogue","speaker":"Büşra","text":"Burada kalırsak sabaha çıkamayız.","dialogueImage":"images/characters/busra.webp"}
      ],
      "choices": [
        {"id":"search_room","text":"Daireyi sessizce ara.","nextSceneId":"apartment_search","previewImage":"images/scenes/istanbul/apartment_search.webp","selectionSummary":"Daireyi sessizce araştıracaksın. Gürültü riski düşük; yararlı kaynak bulma ihtimali var.","riskLevel":"Düşük","effects":[{"type":"ChangeNoise","amount":-5}]},
        {"id":"check_stairs","text":"Merdiven boşluğunu kontrol et.","nextSceneId":"stairwell","previewImage":"images/scenes/istanbul/stairwell_check.webp","selectionSummary":"Sesin kaynağına yaklaşacaksın. Ekip erken uyarı kazanabilir ama fark edilme ihtimali yüksek.","riskLevel":"Yüksek","isDangerous":true,"effects":[{"type":"ChangeNoise","amount":10},{"type":"ChangeThreat","amount":8}]},
        {"id":"force_door","text":"[Güç] Arka servis kapısını zorla.","nextSceneId":"service_door","previewImage":"images/scenes/istanbul/service_door_force.webp","selectionSummary":"Servis kapısını zorlayarak kısa bir kaçış hattı açacaksın. Gürültü binadaki tehdidi üzerine çekebilir.","riskLevel":"Çok Yüksek","lockedReason":"Bu seçenek için 70 Güç gerekli.","conditions":[{"type":"SkillCondition","key":"Güç","operator":">=","amount":70}],"effects":[{"type":"ChangeNoise","amount":20}]},
        {"id":"force_door_crowbar","text":"[Levye Kullan] Servis kapısını zorla.","nextSceneId":"service_door","previewImage":"images/scenes/istanbul/service_door_force.webp","selectionSummary":"Levyeyi kilit boşluğuna sokarak kapıyı daha kontrollü açacaksın.","riskLevel":"Yüksek","conditions":[{"type":"InventoryCondition","operator":"==","value":"crowbar"}],"lockedReason":"Bu seçenek için levye gerekli.","effects":[{"type":"ChangeNoise","amount":12},{"type":"ChangeItemDurability","key":"crowbar","amount":-15}]}
      ]
    },
    {
      "id":"apartment_search",
      "chapterId":"chapter_01","city":"İstanbul","location":"Esenler - 4. Kat Dairesi","day":1,"time":"22:50","isNight":true,
      "title":"Karanlık Odalar",
      "sceneImage":"images/scenes/istanbul/apartment_search.webp",
      "content":[
        {"type":"narration","text":"Dolapların arasında kuru kan izleri var. Mutfak çekmecesinde hâlâ ambalajında bir pil buluyorsun."},
        {"type":"dialogue","speaker":"Yesking","text":"Onu al. Telsiz sandığımızdan daha önemli olabilir."}
      ],
      "choices":[
        {"id":"take_battery","text":"Pili çantana koy.","nextSceneId":"radio_room","previewImage":"images/scenes/radio_room_preview.webp","effects":[{"type":"AddItem","item":{"id":"fresh_battery","name":"Yeni pil","description":"Askerî telsize uygun güçlü pil.","category":"tool","quantity":1,"weight":0.1,"storyTag":"radio_power"}},{"type":"ChangeRelationship","target":"yesking","amount":6}]},
        {"id":"leave_battery","text":"Zaman kaybetmeden telsiz odasına geç.","nextSceneId":"radio_room","previewImage":"images/scenes/radio_room_preview.webp","effects":[{"type":"ChangeThreat","amount":-2}]}
      ]
    },
    {
      "id":"stairwell",
      "chapterId":"chapter_01","city":"İstanbul","location":"Esenler - Merdiven Boşluğu","day":1,"time":"22:50","isNight":true,
      "title":"Aşağıdan Gelen Nefes",
      "sceneImage":"images/scenes/istanbul/stairwell_check.webp",
      "oneShotSounds":["audio/sfx/infected.wav"],
      "noiseIntensity":0.05,
      "content":[
        {"type":"narration","text":"Korkuluğun ardından baktığında iki kat aşağıda eğri bir gölge görüyorsun. Başını ani bir hareketle sana çeviriyor."},
        {"type":"dialogue","speaker":"Bedo","text":"Bizi duydu. Hemen karar ver!"}
      ],
      "timedChoiceSeconds":8,
      "defaultChoiceId":"run_up",
      "choices":[
        {"id":"silent_retreat","text":"Sessizce geri çekil.","nextSceneId":"radio_room","previewImage":"images/scenes/radio_room_preview.webp","isCriticalTimed":true,"conditions":[{"type":"SkillCondition","key":"Çeviklik","operator":">=","amount":60}],"lockedReason":"Bu seçenek için 60 Çeviklik gerekli.","effects":[{"type":"ChangeNoise","amount":-8}]},
        {"id":"run_up","text":"Üst kata koş.","nextSceneId":"roof_trap","previewImage":"images/scenes/rooftop.webp","isDangerous":true,"isCriticalTimed":true,"effects":[{"type":"ChangeNoise","amount":25},{"type":"ChangeHealth","amount":-8}]},
        {"id":"hold_line","text":"Büşra'nın ateş hattını koru.","nextSceneId":"radio_room","previewImage":"images/scenes/istanbul/stairwell_check.webp","isCriticalTimed":true,"conditions":[{"type":"SkillCondition","key":"Taktik","operator":">=","amount":65}],"lockedReason":"Bu seçenek için 65 Taktik gerekli.","effects":[{"type":"ChangeNoise","amount":15},{"type":"ChangeRelationship","target":"busra","amount":8}]}
      ]
    },
    {
      "id":"service_door",
      "chapterId":"chapter_01","city":"İstanbul","location":"Esenler - Servis Koridoru","day":1,"time":"22:53","isNight":true,
      "title":"Kırılan Kilit",
      "sceneImage":"images/scenes/istanbul/service_door_force.webp",
      "oneShotSounds":["audio/sfx/metal_scrape.wav"],
      "screenShakeIntensity":8,
      "noiseIntensity":0.07,
      "content":[
        {"type":"narration","text":"Omzunu kapıya verdiğinde kilit parçalanıyor. Gürültü binada yankılanıyor ama önünüzde kısa bir yol açılıyor."},
        {"type":"dialogue","speaker":"Ambatukam","text":"Artık geri dönüş yok."}
      ],
      "choices":[
        {"id":"service_to_radio","text":"➦ Telsiz odasına ilerle.","nextSceneId":"radio_room","effects":[{"type":"SetFlag","value":"service_route_open"},{"type":"ChangeRelationship","target":"ambatukam","amount":6}]}
      ]
    },
    {
      "id":"roof_trap",
      "chapterId":"chapter_01","city":"İstanbul","location":"Esenler - Çatı Kapısı","day":1,"time":"22:56","isNight":true,
      "title":"Kilitli Çatı",
      "sceneImage":"images/scenes/rooftop.webp",
      "content":[
        {"type":"narration","text":"Çatı kapısı kaynakla kapatılmış. Alt kattaki ayak sesleri çoğalıyor. Karanlık seni duvara sıkıştırıyor."}
      ],
      "choices":[
        {"id":"roof_death","text":"⚠ Kapıyı kırmayı dene.","nextSceneId":"death_roof","isDangerous":true,"effects":[{"type":"ChangeNoise","amount":35}]},
        {"id":"roof_escape","text":"➦ [Teknik] Yangın alarmının servis kilidini aç.","nextSceneId":"radio_room","conditions":[{"type":"SkillCondition","key":"Teknik","operator":">=","amount":70}],"lockedReason":"Bu seçenek için 70 Teknik gerekli.","effects":[{"type":"ChangeHealth","amount":-12},{"type":"SetFlag","value":"escaped_roof"}]}
      ]
    },
    {
      "id":"death_roof",
      "chapterId":"chapter_01","city":"İstanbul","location":"Esenler - Çatı Kapısı","day":1,"time":"23:00","isNight":true,
      "title":"Yolculuğun İstanbul'da Sona Erdi",
      "sceneImage":"images/scenes/rooftop.webp",
      "content":[{"type":"narration","text":"Kapı bir santim bile oynamıyor. Arkandaki ilk çığlığı duyduğunda artık çok geç olduğunu biliyorsun."}],
      "choices":[
        {"id":"accept_roof_death","text":"➦ Sonucu kabul et.","effects":[{"type":"TriggerEnding","key":"death","value":"Çatı kapısında enfekteler tarafından kuşatıldın."}]}
      ]
    },
    {
      "id":"radio_room",
      "chapterId":"chapter_01","city":"İstanbul","location":"Esenler - Yönetici Dairesi","day":1,"time":"23:05","isNight":true,
      "title":"Kesik Yayın",
      "sceneImage":"images/scenes/radio_room.webp",
      "noiseIntensity":0.065,
      "isCheckpoint":true,
      "content":[
        {"type":"narration","text":"Askerî telsiz masanın üzerinde ölü gibi duruyor. Yesking kapağını açarken odada yalnızca enfektelerin uzaktaki çığlıkları duyuluyor."},
        {"type":"dialogue","speaker":"Yesking","text":"Güç verirsek frekansı yakalarım. Ama tek deneme hakkımız olabilir."}
      ],
      "choices":[
        {"id":"use_fresh_battery","text":"Yeni pili telsize tak.","nextSceneId":"broadcast_clear","previewImage":"images/scenes/radio_room_preview.webp","conditions":[{"type":"InventoryCondition","operator":"==","value":"fresh_battery"}],"lockedReason":"Yeni bir pil gerekli.","effects":[{"type":"RemoveItem","key":"fresh_battery"},{"type":"SetFlag","value":"clear_broadcast"},{"type":"UnlockCharacterInfo","target":"busra"}]},
        {"id":"technical_fix","text":"[Teknik] Güç devresini geçici olarak onar.","nextSceneId":"broadcast_clear","previewImage":"images/scenes/radio_room_preview.webp","conditions":[{"type":"SkillCondition","key":"Teknik","operator":">=","amount":75}],"lockedReason":"Bu seçenek için 75 Teknik gerekli.","effects":[{"type":"UseSpecialAbility","target":"yesking"},{"type":"SetFlag","value":"clear_broadcast"}]},
        {"id":"weak_signal","text":"Zayıf pille yayını dinlemeyi dene.","nextSceneId":"broadcast_weak","previewImage":"images/scenes/radio_room_preview.webp","effects":[{"type":"ChangeSanity","amount":-3}]}
      ]
    },
    {